text,target_aos,target_cs,t5_str_pred_aos,flan_t5_str_pred_aos,t5_str_pred_cs,flan_t5_str_pred_cs
Some Pineapple covered in a glaze of some kind and some pear tart thing Not impressive at all .,"( NULL , covered in a glaze of some kind , negative ) ; ( NULL , Not impressive , negative )","( food style_options , negative ) ; ( food quality , negative )","( Pineapple, covered in a glaze of some kind, negative ) ; ( pear tart, Not impressive, negative )","( Pineapple, covered in a glaze of some kind, negative ) ; ( pear tart thing, Not impressive, negative )","( food quality, negative )","( food quality, negative )"
great food /AS/ great wine list /AS/ great service in a great neighborhood . . .,"( food , great , positive ) ; ( wine list , great , positive ) ; ( service , great , positive ) ; ( neighborhood , great , positive )","( food quality , positive ) ; ( drinks style_options , positive ) ; ( service general , positive ) ; ( location general , positive )","( food, great, positive ) ; ( wine list, great, positive ) ; ( service, great, positive ) ; ( neighborhood, great, positive )","( food, great, positive ) ; ( wine list, great, positive ) ; ( service, great, positive ) ; ( neighborhood, great, positive )","( food quality, positive ) ; ( drinks style_options, positive ) ; ( service general, positive ) ; ( location general, positive )","( food quality, positive ) ; ( drinks style_options, positive ) ; ( service general, positive )"
My girlfriend /AS/ being slightly more aggressive /AS/ and having been equally disgusted causing her to throw out the remainder of her barely eaten meal /AS/ called back only to be informed that I was probably wrong and that it was most likely an oyster /AS/ and that we were also blacklisted from their restaurant .,"( meal , disgusted , negative ) ; ( NULL , blacklisted , negative )","( food quality , negative ) ; ( service general , negative )","( NULL, aggressive, negative ) ; ( NULL, disgusted, negative )","( NULL, aggressive, negative ) ; ( NULL, disgusted, negative )","( service general, negative )","( service general, negative )"
The reason there are 4 different results on citysearch for the same place is because they keep trying to start a new thread so they can stock it with positive reviews .,"( NULL , start a new thread so they can stock it with positive reviews , negative )","( restaurant miscellaneous , negative )","( place, positive )","( place, positive )","( restaurant general, negative )","( restaurant general, positive )"
One of the BEST,"( NULL , BEST , positive )","( restaurant general , positive )","( NULL, BEST, positive )","( NULL, BEST, positive )","( restaurant general, positive )","( restaurant general, positive )"
This place is a must visit !,"( place , must visit , positive )","( restaurant general , positive )","( place, must visit, positive )","( place, a must visit, positive )","( restaurant general, positive )","( restaurant general, positive )"
The space is limited so be prepared to wait up to 45 minutes - 1 hour /AS/ but be richly rewarded when you savor the delicious indo - chinese food .,"( space , limited , negative ) ; ( indo - chinese food , delicious , positive )","( restaurant miscellaneous , negative ) ; ( food quality , positive )","( indo - chinese food, delicious, positive ) ; ( space, limited, negative )","( indo - chinese food, delicious, positive ) ; ( space, limited, negative )","( food quality, positive ) ; ( service general, negative )","( food quality, positive ) ; ( restaurant miscellaneous, negative )"
Maybe it was the great company /OB/ I had friends visiting from Philly – yes /AS/ it was not a date this time /CB/ or the super reasonable price point /AS/ but I just can ’ t say enough good things about this brasserie .,"( brasserie , good , positive )","( restaurant general , positive ) ; ( restaurant prices , positive )","( company, great, positive ) ; ( company, not a date this time, negative ) ; ( NULL, reasonable, positive ) ; ( brasserie, good, positive )","( brasserie, good things, positive ) ; ( brasserie, great, positive )","( restaurant general, positive ) ; ( restaurant prices, positive )","( restaurant general, positive ) ; ( restaurant prices, negative )"
The food was great and tasty /AS/ but the sitting space was too small /AS/ I do n ' t like being cramp in a corner .,"( food , great , positive ) ; ( food , tasty , positive ) ; ( sitting space , too small , negative )","( food quality , positive ) ; ( ambience general , negative )","( food, great, positive ) ; ( food, tasty, positive ) ; ( sitting space, too small, negative )","( food, great, positive ) ; ( food, tasty, positive ) ; ( sitting space, small, negative )","( food quality, positive ) ; ( food style_options, negative )","( food quality, positive ) ; ( food style_options, negative )"
The best !,"( NULL , best , positive )","( restaurant general , positive )","( NULL, best, positive )","( NULL, best, positive )","( food quality, positive )","( restaurant general, positive )"
For starters they delivered us someone else ' s order .,"( NULL , delivered us someone else ' s order , negative )","( service general , negative )","( NULL, delivered us someone else's order, negative )","( NULL, delivered us someone else's order, positive )","( service general, negative )","( service general, negative )"
The omlette for brunch is great . . .,"( omlette for brunch , great , positive )","( food quality , positive )","( omlette for brunch, great, positive )","( omlette for brunch, great, positive )","( food quality, positive )","( food quality, positive )"
The waitress was not attentive at all .,"( waitress , not attentive , negative )","( service general , negative )","( waitress, not attentive, negative )","( waitress, not attentive, negative )","( service general, negative )","( service general, negative )"
Again /AS/ no apology /AS/ no is there anything else I can get you /AS/ no can I get you a drink to make up for it /AS/ nothing ! ! ! !,"( NULL , no apology , negative )","( service general , negative )","( NULL, no apology, negative ) ; ( NULL, no can I get you a drink, negative )","( NULL, no apology, negative ) ; ( NULL, no is there anything else I can get you, negative )","( service general, negative )","( service general, negative )"
Excellent food /AS/ although the interior could use some help .,"( food , Excellent , positive ) ; ( interior , help , negative )","( food quality , positive ) ; ( ambience general , negative )","( food, Excellent, positive ) ; ( interior, could use some help, negative )","( food, Excellent, positive ) ; ( interior, need some help, negative )","( food quality, positive ) ; ( ambience general, negative )","( food quality, positive ) ; ( ambience general, negative )"
No desert menu /AS/ no apology /AS/ nothing ! ! ! ! ! !,"( NULL , no apology , negative )","( service general , negative )","( desert menu, No desert menu, no apology, negative ) ; ( NULL, nothing, negative )","( desert menu, No desert menu, negative ) ; ( no apology, negative ) ; ( NULL, nothing, negative )","( food quality, negative )","( food quality, negative )"
Fabulous food - if the front of house staff do n ' t put you off –,"( food , Fabulous , positive ) ; ( front of house staff , put you off , negative )","( food quality , positive ) ; ( service general , negative )","( food, Fabulous, positive )","( food, Fabulous, positive )","( food quality, positive )","( food quality, positive )"
The frizzy retro girl /OB/ with winged / Dame Edna glasses /CB/ will yell at you if you try to order a drink .,"( girl , frizzy , negative )","( service general , negative )","( frizzy retro girl, yell, negative ) ; ( winged / Dame Edna glasses, yell, negative )","( frizzy retro girl, yell, negative )","( drinks style_options, negative )","( service general, negative )"
The DJ is awesome /AS/ I have been there for my birthday and a bunch of other times with friends and I keep going back .,"( DJ , awesome , positive ) ; ( NULL , keep going back , positive )","( ambience general , positive ) ; ( restaurant general , positive )","( DJ, awesome, positive )","( DJ, awesome, positive )","( ambience general, positive )","( ambience general, positive )"
Cool atmosphere /AS/ the fire place in the back really ads to it but needs a bit more heat throughout on a cold night .,"( atmosphere , Cool , positive ) ; ( fire place , really ads to it , positive )","( ambience general , positive )","( atmosphere, Cool, positive ) ; ( fire place, ads to it, positive ) ; ( NULL, needs a bit more heat, negative )","( atmosphere, Cool, positive ) ; ( fire place, ads, positive ) ; ( fire place, needs a bit more heat, negative )","( ambience general, positive ) ; ( ambience general, positive )","( ambience general, positive )"
I have never left a restaurant feeling as if i was abused /AS/ and wasted my hard earned money .,"( restaurant , abused , negative )","( restaurant general , negative ) ; ( restaurant prices , negative )","( restaurant, abused, positive ) ; ( restaurant, wasted, positive )","( restaurant, never left, positive ) ; ( restaurant, abused, negative ) ; ( restaurant, wasted my hard earned money, positive )","( restaurant general, positive )","( restaurant general, positive )"
Amazing food .,"( food , Amazing , positive )","( food quality , positive )","( food, Amazing, positive )","( food, Amazing, positive )","( food quality, positive )","( food quality, positive )"
I ' ll being with a couple of positives : cool decor /AS/ good pita and hummus /AS/ and grilled octopus that was actually pretty tasty .,"( decor , cool , positive ) ; ( pita , good , positive ) ; ( hummus , good , positive ) ; ( grilled octopus , tasty , positive )","( ambience general , positive ) ; ( food quality , positive )","( decor, cool, positive ) ; ( pita and hummus, good, positive ) ; ( grilled octopus, tasty, positive )","( decor, cool, positive ) ; ( pita, good, positive ) ; ( hummus, good, positive ) ; ( grilled octopus, tasty, positive )","( ambience general, positive ) ; ( food quality, positive )","( ambience general, positive ) ; ( food quality, positive )"
I LOOOVE their eggplant pizza /AS/ as well as their pastas !,"( eggplant pizza , LOOOVE , positive ) ; ( pastas , LOOOVE , positive )","( food quality , positive )","( eggplant pizza, LOOOVE, positive ) ; ( pastas, LOOOVE, positive )","( eggplant pizza, LOVE, positive ) ; ( pastas, LOVE, positive )","( food quality, positive )","( food quality, positive )"
Great Shabu Shabu,"( Shabu Shabu , Great , positive )","( food quality , positive )","( Shabu Shabu, Great, positive )","( Shabu Shabu, Great, positive )","( food quality, positive )","( food quality, positive )"
BEST DINING EXPERIENCE IN THE WEST VILLAGE !,"( NULL , BEST , positive )","( restaurant general , positive )","( DINING, BEST, positive )","( DINING EXPERIENCE, BEST, positive )","( restaurant general, positive )","( restaurant general, positive )"
Can ' t argue about that /AS/ but they are clearly over priced .,"( NULL , over priced , negative )","( food prices , negative )","( NULL, over priced, negative )","( NULL, over priced, negative )","( restaurant prices, negative ) ; ( restaurant general, negative )","( restaurant prices, negative )"
Considering you will spend at least $ 60 a head /AS/ I expect better service .,"( service , expect better , negative )","( service general , negative )","( service, better, positive )","( service, better, positive )","( service general, negative )","( service general, positive )"
Over all it was a very nice romantic place .,"( place , nice romantic , positive )","( restaurant general , positive ) ; ( ambience general , positive )","( place, nice romantic, positive )","( place, nice romantic, positive )","( ambience general, positive )","( ambience general, positive )"
The food is all shared so we get to order together and eat together .,"( food , shared , positive )","( food style_options , positive )","( food, shared, positive )","( food, shared, positive )","( food style_options, positive )","( food style_options, positive )"
When we inquired about ports - the waitress listed off several but did not know taste variations or cost .,"( waitress , did not know , negative )","( service general , negative )","( waitress, did not know taste variations or cost, negative )","( waitress, listed off several, negative ) ; ( waitress, did not know taste variations or cost, negative )","( service general, negative )","( service general, negative ) ; ( food prices, negative )"
I asked for a menu and the same waitress looked at my like I was insane .,"( waitress , insane , negative )","( service general , negative )","( waitress, insane, negative )","( waitress, insane, negative )","( service general, negative )","( service general, negative )"
The only thing that strikes you is the decor ? /OB/ not very pleasant /CB/ .,"( decor , not very pleasant , negative )","( ambience general , negative )","( decor, not very pleasant, negative )","( decor, not very pleasant, negative )","( ambience general, negative )","( ambience general, negative )"
On that scale /AS/ it ' s a world - beater .,"( NULL , world - beater , negative )","( restaurant general , negative )","( NULL, world - beater, positive )","( NULL, world - beater, positive )","( restaurant general, positive )","( restaurant general, positive )"
The service was extremely fast and attentive /OB/ thanks to the service button on your table /CB/ but I barely understood 1 word when the waiter took our order .,"( service , fast , positive ) ; ( service , attentive , positive ) ; ( service button , thanks to , positive ) ; ( waiter , barely understood , negative )","( service general , mixed )","( service, fast, positive ) ; ( service, attentive, positive ) ; ( waiter, barely understood 1 word, negative )","( service, fast, positive ) ; ( service, attentive, positive ) ; ( waiter, barely understood 1 word, negative )","( service general, positive )","( service general, positive )"
At first we were a little taken aback /AS/ as this seemed to present a problem /AS/ although the restaurant looked fairly empty /AS/ but they hastily put the table together for us .,"( NULL , hastily put the table together for us , positive )","( service general , positive )","( restaurant, empty, negative ) ; ( restaurant, hastily put the table together, positive )","( table, put together, positive )","( service general, mixed )","( service general, positive )"
The food is flavorful /AS/ plentiful and reasonably priced .,"( food , flavorful , positive ) ; ( food , plentiful , positive ) ; ( food , reasonably priced , positive )","( food quality , positive ) ; ( food style_options , positive ) ; ( food prices , positive )","( food, flavorful, positive ) ; ( food, plentiful, positive ) ; ( food, reasonably priced, positive )","( food, flavorful, positive ) ; ( food, plentiful, positive ) ; ( food, reasonably priced, positive )","( food quality, positive ) ; ( food prices, positive )","( food quality, positive ) ; ( food prices, positive )"
I would not expect this for a $ 55 dinner .,"( dinner , would not expect , negative ) ; ( dinner , $ 55 , negative )","( food quality , negative ) ; ( food prices , negative )","( NULL, not expect, negative )","( NULL, not expect this, negative )","( food prices, negative )","( food prices, negative )"
A different server enhanced the fun /AS/ dumping our entrees in front of us halfway through our appetizer /OB/ which was delicious /CB/ .,"( server , enhanced , negative ) ; ( appetizer , delicious , positive )","( service general , negative ) ; ( food quality , positive )","( server, fun, positive )","( entrees, delicious, positive ) ; ( entrees, fun, positive )","( food quality, positive )","( food quality, positive )"
Yes /AS/ the place is classy and beautiful /AS/ but they most certainly target the uber whealthy Not the common joe that wants to go all out every once in a while .,"( place , classy , positive ) ; ( place , beautiful , positive ) ; ( place , target the uber whealthy , negative )","( ambience general , positive ) ; ( restaurant prices , negative )","( place, classy, positive ) ; ( place, beautiful, positive ) ; ( place, uber whealthy, positive )","( place, classy, positive ) ; ( place, beautiful, positive ) ; ( place, target the uber whealthy, negative )","( ambience general, positive )","( ambience general, positive )"
It ' s a great place to order from or sit - in .,"( place , great , positive )","( restaurant miscellaneous , positive )","( place, great, positive )","( place, great, positive )","( restaurant general, positive )","( restaurant general, positive )"
Best Indian Restaurant in the City,"( Indian Restaurant , Best , positive )","( restaurant general , positive )","( Indian Restaurant, Best, positive )","( Indian Restaurant, Best, positive )","( restaurant general, positive )","( restaurant general, positive )"
lobster was good /AS/ nothing spectacular .,"( lobster , good , neutral )","( food quality , neutral )","( lobster, good, neutral ) ; ( lobster, nothing spectacular, negative )","( lobster, good, positive ) ; ( lobster, nothing spectacular, neutral )","( food quality, neutral )","( food quality, neutral )"
The veal was incredible last night .,"( veal , incredible , positive )","( food quality , positive )","( veal, incredible, positive )","( veal, incredible, positive )","( food quality, positive )","( food quality, positive )"
Highly recommended !,"( NULL , Highly recommended , positive )","( restaurant general , positive )","( NULL, Highly recommended, positive )","( NULL, Highly recommended, positive )","( restaurant general, positive )","( restaurant general, positive )"
Bison was quite excellent however .,"( Bison , excellent , positive )","( food quality , positive )","( Bison, excellent, positive )","( Bison, excellent, positive )","( food quality, positive )","( food quality, positive )"
However /AS/ once I received my predictably mediocre order of what Dokebi thinks passes as Korean fair /AS/ /OB/ sometimes you have to settle when it ' s your only option /CB/ /AS/ I got through about half my kimchee before I found a piece of random lettuce accompanied by a far more disgusting /AS/ slimy /AS/ clearly bad piece of fish skin .,"( kimchee , disgusting , negative ) ; ( Korean fair , mediocre , negative )","( food quality , negative )","( kimchee, disgusting, negative ) ; ( fish skin, disgusting, negative ) ; ( fish skin, bad, negative ) ; ( lettuce, slimy, negative )","( kimchee, mediocre, negative ) ; ( lettuce, random, negative ) ; ( fish skin, bad, negative )","( food quality, negative )","( food quality, negative )"
At first glance this place seems a bit pricey for a hot dog joint /AS/ but at Bark you do n ' t just get your average hot dog .,"( Bark , pricey , negative )","( restaurant prices , negative )","( hot dog joint, pricey, negative )","( hot dog, average, positive ) ; ( place, pricey, negative )","( food prices, mixed ) ; ( food quality, positive )","( food quality, positive ) ; ( food prices, negative )"
This place has great indian chinese food .,"( indian chinese food , great , positive )","( food quality , positive )","( indian chinese food, great, positive )","( indian chinese food, great, positive )","( food quality, positive )","( food quality, positive )"
I tried a couple other dishes but was n ' t too impressed .,"( dishes , was n ' t too impressed , neutral )","( food quality , neutral )","( dishes, tried, negative ) ; ( dishes, wasn't too impressed, negative )","( dishes, wasn't too impressed, negative )","( food quality, negative )","( food quality, negative )"
The place is beautiful !,"( place , beautiful , positive )","( ambience general , positive )","( place, beautiful, positive )","( place, beautiful, positive )","( ambience general, positive )","( ambience general, positive )"
Impressed . . .,"( NULL , Impressed , positive )","( restaurant general , positive )","( NULL, Impressed, positive )","( NULL, Impressed, positive )","( restaurant general, positive )","( restaurant general, positive )"
Over all the looks of the place exceeds the actual meals .,"( looks , exceeds , positive )","( ambience general , positive )","( looks, exceeds the actual meals, positive )","( meals, exceeds, negative )","( ambience general, positive )","( food style_options, negative )"
Maitre - D - `` Eat and get out ``,"( Maitre - D , get out , negative )","( service general , negative )","( Maitre - D -, get out, positive )","( Maitre - D, Eat and get out, positive )","( food quality, positive )","( restaurant miscellaneous, positive )"
Mine tasted like the bartender had forgotten to add the tequila .,"( NULL , forgotten , negative )","( drinks quality , negative )","( tequila, forgot, negative )","( tequila, forgotten, negative )","( drinks quality, negative )","( drinks quality, negative )"
The environment is very upscale and you will see a lot of rich guys with trophy wives or just highly paid escorts .,"( environment , upscale , neutral )","( ambience general , neutral )","( environment, upscale, positive )","( environment, upscale, positive ) ; ( escorts, highly paid, positive )","( ambience general, positive )","( ambience general, positive ) ; ( service general, positive )"
I highly recommend this beautiful place .,"( place , recommend , positive ) ; ( place , beautiful , positive )","( ambience general , positive ) ; ( restaurant general , positive )","( place, recommend, positive )","( place, recommend, positive )","( restaurant general, positive )","( restaurant general, positive )"
I am actually offended to have spent so much money on such a bad experience .,"( NULL , bad , negative ) ; ( NULL , so much money , negative )","( restaurant general , negative ) ; ( restaurant prices , negative )","( NULL, offended, negative )","( NULL, offended, negative )","( restaurant prices, negative )","( restaurant general, negative )"
And even more so unpleasant because it was so costly for such an unpleasant experience .,"( NULL , unpleasant , negative ) ; ( NULL , costly , negative )","( restaurant general , negative ) ; ( restaurant prices , negative )","( NULL, unpleasant, negative )","( NULL, unpleasant, negative ) ; ( NULL, costly, negative )","( restaurant prices, negative )","( restaurant prices, negative ) ; ( restaurant general, negative )"
I can ' t remember the last time I had such gross food in New York .,"( food , gross , negative )","( food quality , negative )","( food, gross, negative )","( food, gross, negative )","( food quality, negative )","( food quality, negative )"
everyone was cheerfully cooperative and helpful .,"( NULL , cheerfully cooperative , positive ) ; ( NULL , helpful , positive )","( service general , positive )","( NULL, cheerfully cooperative, positive ) ; ( NULL, helpful, positive )","( NULL, cheerfully, positive ) ; ( NULL, cooperatively, positive ) ; ( NULL, helpful, positive )","( service general, positive )","( service general, positive )"
My wife had barely touched that mess of a dish .,"( dish , mess , negative )","( food quality , negative )","( dish, mess, negative )","( mess of a dish, barely touched, neutral )","( food quality, negative )","( food style_options, neutral )"
This place is not inviting and the food is totally weird .,"( place , not inviting , negative ) ; ( food , weird , negative )","( ambience general , negative ) ; ( food quality , negative )","( place, not inviting, negative ) ; ( food, weird, negative )","( place, not inviting, negative ) ; ( food, weird, negative )","( ambience general, negative ) ; ( food quality, negative )","( ambience general, negative )"
The family seafood entree was very good .,"( family seafood entree , good , positive )","( food quality , positive )","( family seafood entree, good, positive )","( family seafood entree, good, positive )","( food quality, positive )","( food quality, positive )"
There are no negatives to speak of .,"( NULL , no negatives , positive )","( restaurant general , positive )","( NULL, no negatives, positive )","( NULL, no negatives, positive )","( restaurant general, positive )","( restaurant general, positive )"
Price is high but the food is good /AS/ so I would come back again .,"( food , good , positive ) ; ( food , high , negative ) ; ( NULL , come back , positive )","( food quality , positive ) ; ( food prices , negative ) ; ( restaurant general , positive )","( NULL, high, negative ) ; ( food, good, positive )","( NULL, high, negative ) ; ( food, good, positive )","( restaurant prices, negative ) ; ( food quality, positive )","( restaurant prices, negative ) ; ( food quality, positive )"
I HAVE NEVER EVER HAD SUCH AN UNPLEASANT EXPERIENCE .,"( NULL , UNPLEASANT , negative )","( restaurant general , negative )","( NULL, UNPLEASANT, positive )","( NULL, NEVER EVER HAD SUCH AN UNPLEASANT, positive )","( restaurant general, positive )","( restaurant general, positive )"
More Williamsburg Garbage,"( NULL , Garbage , negative )","( restaurant general , negative )","( Williamsburg Garbage, More, positive )","( Williamsburg Garbage, More, positive )","( food quality, positive )","( food quality, negative )"
The bar drinks were Eh /AS/ ok to say the least .,"( bar drinks , ok , negative )","( drinks quality , negative )","( bar drinks, ok, neutral )","( bar drinks, ok to say the least, neutral )","( drinks quality, neutral )","( drinks quality, neutral )"
Great /AS/ original taste .,"( NULL , Great , positive ) ; ( NULL , original , positive )","( food quality , positive )","( NULL, Great, positive ) ; ( NULL, original taste, positive )","( NULL, Great, positive ) ; ( original taste, original, positive )","( food quality, positive )","( food quality, positive )"
