text,target_aos,target_cs,t5_str_pred_aos,flan_t5_str_pred_aos,t5_str_pred_cs,flan_t5_str_pred_cs
Can ’ t believe how an expensive NYC restaurant can be so disrespectful to its clients .,"( restaurant , expensive , negative ) ; ( NULL , disrespectful , negative )","( restaurant prices , negative ) ; ( service general , negative )","( restaurant, disrespectful, negative ) ; ( restaurant, expensive, negative )","( restaurant, disrespectful, negative )","( restaurant general, negative )","( service general, negative )"
Creative /AS/ consistent /AS/ fresh .,"( NULL , consistent , positive ) ; ( NULL , Creative , positive ) ; ( NULL , fresh , positive )","( food quality , positive ) ; ( food style_options , positive )","( NULL, Creative, positive ) ; ( NULL, consistent, positive ) ; ( NULL, fresh, positive )","( NULL, Creative, positive ) ; ( NULL, consistent, positive ) ; ( NULL, fresh, positive )","( ambience general, positive )","( food quality, positive )"
the crust was imazingly cooked well and pizza was fully loaded : /CB/ : /CB/ : /CB/,"( crust , cooked well , positive ) ; ( pizza , fully loaded , positive )","( food quality , positive ) ; ( food style_options , positive )","( crust, imazingly cooked well, positive ) ; ( pizza, fully loaded, positive )","( crust, well cooked, positive ) ; ( pizza, fully loaded, positive )","( food quality, positive )","( food quality, positive )"
This was /AS/ from start to finish /AS/ a mind - bogglingly uncomfortable experience .,"( NULL , mind - bogglingly uncomfortable , negative )","( restaurant general , negative )","( NULL, mind - bogglingly uncomfortable, negative )","( NULL, mind - bogglingly uncomfortable, negative )","( food quality, negative )","( restaurant general, negative )"
I literally just got back home after visiting Casa La Femme and was so offended by my visit felt it necessary to try and warn other diners who value their money and time .,"( Casa La Femme , offended , negative )","( restaurant general , negative ) ; ( restaurant prices , negative )","( Casa La Femme, offended, negative )","( Casa La Femme, offended, negative )","( restaurant general, negative )","( restaurant prices, negative )"
never swaying /AS/ never a bad meal /AS/ never bad service . . .,"( NULL , never swaying , positive ) ; ( meal , never a bad , positive ) ; ( service , never bad , positive )","( restaurant general , positive ) ; ( food quality , positive ) ; ( service general , positive )","( meal, never a bad, positive ) ; ( service, never bad, positive )","( meal, never swaying, positive ) ; ( service, never bad, positive )","( food quality, positive ) ; ( service general, positive )","( food quality, positive ) ; ( service general, positive )"
They have a delicious banana chocolate dessert /AS/ as well as a great green tea tempura .,"( banana chocolate dessert , delicious , positive ) ; ( green tea tempura , great , positive )","( food quality , positive )","( banana chocolate dessert, delicious, positive ) ; ( green tea tempura, great, positive )","( banana chocolate dessert, delicious, positive ) ; ( green tea tempura, great, positive )","( food quality, positive )","( food quality, positive )"
This is the MOST wonderful restaurant in all of New York City /AS/ not just Brooklyn . . .,"( restaurant , wonderful , positive )","( restaurant general , positive )","( restaurant, wonderful, positive )","( restaurant, wonderful, positive )","( restaurant general, positive )","( restaurant general, positive )"
Overpriced and not tasty,"( NULL , Overpriced , negative ) ; ( NULL , not tasty , negative )","( food prices , negative ) ; ( food quality , negative )","( NULL, Overpriced, negative ) ; ( NULL, not tasty, negative )","( NULL, not tasty, negative ) ; ( NULL, Overpriced, negative )","( food quality, negative ) ; ( food prices, negative )","( food prices, negative ) ; ( food quality, negative )"
The waiter delivered our food while holding what appeared to be a plastic bag of garbage in one hand .,"( waiter , garbage , negative )","( service general , negative )","( waiter, holding what appeared to be a plastic bag of garbage, negative )","( waiter, holding a plastic bag of garbage, negative )","( service general, negative )","( service general, negative )"
They are extremely rude /AS/ not even apologizing for the horrible service we got and handing us a bill well over $ 500 for some drinks adn their pita bread !,"( service , horrible , negative ) ; ( drinks , over $ 500 , negative ) ; ( pita bread , over $ 500 , negative ) ; ( NULL , rude , negative )","( service general , negative ) ; ( drinks prices , negative ) ; ( food prices , negative )","( NULL, rude, negative ) ; ( NULL, horrible, negative )","( NULL, rude, negative )","( service general, negative )","( service general, negative ) ; ( food prices, negative )"
so delicious ! ! ! ! ! !,"( NULL , delicious , positive )","( food quality , positive )","( NULL, delicious, positive )","( NULL, delicious, positive )","( food quality, positive )","( food quality, positive )"
Stay away,"( NULL , Stay away , negative )","( restaurant general , negative )","( NULL, Stay away, negative )","( NULL, Stay away, negative )","( restaurant general, negative )","( restaurant general, negative )"
Best . Sushi . Ever .,"( Sushi , Best , positive )","( food quality , positive )","( Sushi, Best, positive )","( Sushi, Best, positive )","( food quality, positive )","( food quality, positive )"
Raymond the bartender rocks !,"( Raymond , rocks , positive )","( service general , positive )","( Raymond, rocks, positive )","( Raymond, rocks, positive )","( service general, positive )","( service general, positive )"
The hostess was rude and I got a distinct feeling that they did not want to serve us .,"( hostess , rude , negative ) ; ( NULL , distinct , negative )","( service general , negative )","( hostess, rude, negative )","( hostess, rude, negative )","( service general, negative )","( service general, negative )"
I wanted to go there to see if it was worth it and sadly /AS/ curiousity got the best of me and I paid dearly for it .,"( NULL , sadly , negative ) ; ( NULL , paid dearly for it , negative )","( restaurant general , negative ) ; ( restaurant prices , negative )","( NULL, worth, negative )","( NULL, worth, positive ) ; ( NULL, curiousity, negative )","( restaurant prices, negative ) ; ( restaurant general, negative )","( restaurant general, negative ) ; ( restaurant prices, negative )"
Look /AS/ the appetizers were really good .,"( appetizers , good , positive )","( food quality , positive )","( appetizers, good, positive )","( appetizers, good, positive )","( food quality, positive )","( food quality, positive )"
The food and service were fine /AS/ however the maitre - D was incredibly unwelcoming and arrogant .,"( food , fine , positive ) ; ( service , fine , positive ) ; ( maitre - D , unwelcoming , negative ) ; ( maitre - D , arrogant , negative )","( food quality , positive ) ; ( service general , mixed )","( food, fine, neutral ) ; ( service, fine, negative ) ; ( maitre - D, unwelcoming, negative ) ; ( maitre - D, arrogant, negative )","( food, fine, neutral ) ; ( service, fine, neutral ) ; ( maitre - D, unwelcoming, negative ) ; ( maitre - D, arrogant, negative )","( food quality, negative ) ; ( service general, negative )","( food quality, mixed ) ; ( service general, negative )"
The flavors are amazing and the value is phenomenal .,"( NULL , amazing , positive ) ; ( NULL , phenomenal , positive )","( food quality , positive ) ; ( food prices , positive )","( flavors, amazing, positive ) ; ( value, phenomenal, positive )","( flavors, amazing, positive ) ; ( value, phenomenal, positive )","( food quality, positive ) ; ( restaurant prices, positive )","( food quality, positive ) ; ( restaurant prices, positive )"
The potato balls were not dry at all . . . in fact it was buttery .,"( potato balls , not dry , positive )","( food quality , positive )","( potato balls, not dry, positive ) ; ( potato balls, buttery, positive )","( potato balls, not dry, positive ) ; ( potato balls, buttery, positive )","( food quality, positive )","( food quality, positive )"
great toppings definitely a place you need to check out for late night munchies or a mid day boost !,"( toppings , great , positive ) ; ( place , great , positive )","( food quality , positive ) ; ( restaurant miscellaneous , positive )","( toppings, great, positive )","( toppings, great, positive )","( food quality, positive )","( food quality, positive )"
The food tasted very good .,"( food , good , positive )","( food quality , positive )","( food, good, positive )","( food, good, positive )","( food quality, positive )","( food quality, positive )"
Overall /AS/ decent food at a good price /AS/ with friendly people .,"( food , decent , positive ) ; ( food , good , positive ) ; ( people , friendly , positive )","( food quality , positive ) ; ( food prices , positive ) ; ( service general , positive )","( food, decent, positive ) ; ( people, friendly, positive ) ; ( NULL, good, positive )","( food, decent, positive ) ; ( people, friendly, positive ) ; ( NULL, good, positive )","( food quality, positive ) ; ( food prices, positive ) ; ( service general, positive )","( food quality, positive ) ; ( restaurant prices, positive ) ; ( service general, positive )"
I do n ' t appreciate places or people that try to drive up the bill without the patron ' s knowledge so that was a huge turnoff /OB/ more than the price /CB/ .,"( NULL , drive up the bill , negative ) ; ( NULL , huge turnoff , negative )","( service general , negative ) ; ( restaurant prices , negative )","( place, don't appreciate, negative ) ; ( place, huge turnoff, negative )","( place, don't appreciate, negative ) ; ( people, try to drive up the bill, negative ) ; ( place, turnoff, negative )","( restaurant prices, negative ) ; ( restaurant general, negative )","( service general, negative ) ; ( restaurant prices, negative )"
A quintessential slice of NYC pizza .,"( slice of NYC pizza , quintessential , neutral )","( food quality , neutral )","( pizza, quintessential, positive )","( pizza, quintessential, positive )","( food quality, positive )","( food quality, positive )"
For each course we waited over 1 / 2 hour to 45 minutes and were never offered a drink .,"( NULL , waited over 1 / 2 hour to 45 minutes , negative )","( service general , negative )","( NULL, waited over 1 / 2 hour to 45 minutes, negative )","( NULL, never offered a drink, negative )","( service general, negative )","( service general, negative )"
Super YUMMY Pizza !,"( Pizza , YUMMY , positive )","( food quality , positive )","( Pizza, Super YUMMY, positive )","( Pizza, YUMMY, positive )","( food quality, positive )","( food quality, positive )"
would NOT go back .,"( NULL , NOT go back , negative )","( restaurant general , negative )","( NULL, NOT go back, negative )","( NULL, DO NOT go back, negative )","( restaurant general, negative )","( restaurant general, negative )"
All the various Greek and Cypriot dishes are excellent /AS/ but the gyro is the reason to come - - if you do n ' t eat one your trip was wasted .,"( Greek and Cypriot dishes , excellent , positive ) ; ( gyro , the reason to come , positive )","( food quality , positive )","( Greek and Cypriot dishes, excellent, positive ) ; ( gyro, the reason to come, positive )","( Greek, excellent, positive ) ; ( Cypriot dishes, excellent, positive ) ; ( gyro, wasted, negative )","( food quality, mixed )","( food quality, positive ) ; ( restaurant general, negative )"
Wish NY had more of these kind of places : intimate /AS/ superb food /AS/ homey /AS/ top notch all the way around /AS/ certainly worth the wait .,"( NULL , intimate , positive ) ; ( food , superb , positive ) ; ( NULL , worth , positive )","( ambience general , positive ) ; ( food quality , positive ) ; ( restaurant general , positive )","( food, superb, positive ) ; ( place, intimate, positive ) ; ( place, homey, positive ) ; ( place, top notch, positive ) ; ( wait, worth, positive )","( food, superb, positive ) ; ( homey, positive ) ; ( top notch, positive )","( ambience general, positive ) ; ( food quality, positive ) ; ( ambience general, positive )","( food quality, positive ) ; ( ambience general, positive ) ; ( restaurant prices, positive )"
Bukhara is on my top 5 Indian places in NYC,"( Bukhara , top , positive )","( restaurant general , positive )","( Bukhara, top 5 Indian places, positive )","( Bukhara, top 5 Indian places, positive )","( restaurant general, positive )","( restaurant general, positive )"
Service not the friendliest to our `` large party `` !,"( Service , not the friendliest , negative )","( service general , negative )","( Service, not the friendliest, negative )","( Service, not friendliest, negative )","( service general, negative )","( service general, negative )"
I CAN EAT HERE EVERY DAY OF THE WEEK REALLY LOL LOVE THIS PLACE . . . /CB/,"( PLACE , LOVE , positive )","( restaurant general , positive )","( PLACE, LOVE, positive )","( PLACE, LOVE, positive )","( restaurant general, positive )","( restaurant general, positive )"
Best Indian Chinese in the city /AS/ by far !,"( Indian Chinese , Best , positive )","( food quality , positive )","( Indian Chinese, Best, positive )","( Indian Chinese, Best, positive )","( food quality, positive )","( food quality, positive )"
There ' s another girl who I ca n ' t describe /AS/ she is about 5 ' 6 `` with brown hair /AS/ who eavesdrops on your conversation and chimes in - except she only hears the last part of what you said /AS/ so her uninvited opinions are often out of context and nothing to do with what you ' re *really * talking about .,"( girl , uninvited , negative )","( service general , negative )","( girl, can't describe, negative ) ; ( girl, brown hair, negative ) ; ( NULL, eavesdrops, negative )","( girl, uninvited, negative )","( service general, negative )","( service general, negative )"
The service was quick and friendly .,"( service , quick , positive )","( service general , positive )","( service, quick, positive ) ; ( service, friendly, positive )","( service, quick, positive ) ; ( service, friendly, positive )","( service general, positive )","( service general, positive )"
On the way out /AS/ we heard of other guests complaining about similar issues .,"( NULL , complaining , negative )","( service general , negative )","( NULL, complaining, negative )","( NULL, complaining, negative )","( service general, negative )","( service general, negative )"
The sake ’ s complimented the courses very well and is successfully easing me into the sake world .,"( sake ’ s , very well , positive ) ; ( sake ’ s , successfully , positive )","( drinks quality , positive )","( sake ’ s, complimented, positive ) ; ( sake ’ s, successfully easing me into the sake world, positive )","( sake, complimented, positive ) ; ( sake, easing me, positive )","( service general, positive )","( drinks quality, positive )"
Fresh /AS/ mind blowing flavors .,"( NULL , Fresh , positive ) ; ( NULL , mind blowing , positive )","( food quality , positive )","( NULL, Fresh, positive ) ; ( NULL, mind blowing, positive )","( NULL, Fresh, positive ) ; ( NULL, mind blowing, positive )","( food quality, positive )","( food quality, positive )"
Dumbfoundingly Poor,"( NULL , Dumbfoundingly Poor , negative )","( restaurant general , negative )","( NULL, Dumbfoundingly Poor, negative )","( NULL, Dumbfoundingly Poor, negative )","( food quality, negative )","( restaurant general, negative )"
All in all the food was good - a little on the expensive side /AS/ but fresh .,"( food , fresh , positive ) ; ( food , good , positive ) ; ( food , expensive , negative )","( food quality , positive ) ; ( food prices , negative )","( food, good, positive ) ; ( food, expensive, negative ) ; ( food, fresh, positive )","( food, good, positive ) ; ( food, expensive, negative ) ; ( food, fresh, positive )","( food quality, positive ) ; ( food prices, negative ) ; ( food style_options, positive )","( food quality, positive ) ; ( food prices, negative )"
Sushi experience was unbelievable with my fiance .,"( Sushi , unbelievable , positive )","( food quality , positive )","( Sushi, unbelievable, positive )","( Sushi, unbelievable, positive )","( food quality, positive )","( food quality, positive )"
Single Worst Restaurant in Manhattan,"( Restaurant , Worst , negative )","( restaurant general , negative )","( Single Worst Restaurant, Worst, negative )","( Restaurant, Worst, negative )","( restaurant general, negative )","( restaurant general, negative )"
Patsy ' s Pizza - true love,"( Patsy ' s Pizza , true love , positive )","( restaurant general , positive )","( Patsy's Pizza, love, positive )","( Patsy's Pizza, love, positive )","( restaurant general, positive )","( restaurant general, positive )"
What really makes it shine is the food /AS/ which is aggressively seasoned with Cyrpriot spices /AS/ and all made in - house /OB/ even the gyro meat and sausages /CB/ /AS/ and made of much higher quality ingredients that might otherwise be expected .,"( food , shine , positive ) ; ( gyro meat , in - house , positive ) ; ( sausages , in - house , positive ) ; ( ingredients , higher quality , positive )","( food quality , positive )","( food, shine, positive ) ; ( food, aggressively seasoned with Cyrpriot spices, positive ) ; ( gyro meat and sausages, higher quality, positive )","( food, aggressively seasoned, positive ) ; ( ingredients, made in - house, positive ) ; ( gyro meat and sausages, higher quality, positive )","( food quality, positive ) ; ( food style_options, positive )","( food quality, positive )"
Great Indian Food !,"( Indian Food , Great , positive )","( food quality , positive )","( Indian Food, Great, positive )","( Indian Food, Great, positive )","( food quality, positive )","( food quality, positive )"
The appetizers we ordered were served quickly - an order of fried oysters and clams were delicious but a tiny portion /OB/ maybe 3 of each /CB/ .,"( fried oysters and clams , delicious , positive ) ; ( fried oysters and clams , tiny portion , negative ) ; ( NULL , served quickly , positive )","( food quality , positive ) ; ( food style_options , negative ) ; ( service general , positive )","( appetizers, quickly, positive ) ; ( fried oysters, delicious, positive ) ; ( clams, tiny, negative )","( appetizers, quickly, positive ) ; ( fried oysters, delicious, positive ) ; ( clams, delicious, positive ) ; ( portion, tiny, negative )","( food quality, mixed )","( food quality, positive ) ; ( food style_options, positive )"
My main concern was the sanity of the food that was being sent out to myself and others /AS/ but I would be lying is I said that as someone who has worked in restaurants since the age of fifteen I was expecting at least a minimal effort on the part of the restaurant to amend the situation .,"( food , concern , negative )","( food quality , negative )","( food, sanity, negative )","( food, sanity, negative )","( food quality, mixed )","( food quality, negative )"
Prices are fair across the board for both food and bev .,"( food , fair , positive ) ; ( bev , fair , positive )","( food prices , positive ) ; ( drinks prices , positive )","( NULL, fair, positive )","( NULL, fair, positive )","( restaurant prices, positive )","( restaurant prices, positive )"
One special roll and one regular roll is enough to fill you up /AS/ but save room for dessert !,"( dessert , save room , positive ) ; ( special roll , enough , positive ) ; ( regular roll , enough , positive )","( food quality , positive ) ; ( food style_options , positive )","( roll, special, positive ) ; ( roll, save room, positive )","( special roll, enough, positive ) ; ( regular roll, enough, positive )","( food style_options, positive ) ; ( food style_options, positive )","( food style_options, neutral )"
On our last visit /AS/ they skipped over our name on the list /AS/ leaving us waiting an extra hour for a table .,"( NULL , waiting an extra hour , negative )","( service general , negative )","( NULL, skipped over our name, negative )","( NULL, wait, negative )","( service general, negative )","( service general, negative )"
Try it !,"( NULL , Try , positive )","( restaurant general , positive )","( NULL, Try, positive )","( NULL, Try, positive )","( restaurant general, positive )","( restaurant general, positive )"
Favorite Sushi in NYC,"( Sushi , Favorite , positive )","( food quality , positive )","( Sushi, Favorite, positive )","( Sushi, Favorite, positive )","( food quality, positive )","( food quality, positive )"
The wine list was extensive - though the staff did not seem knowledgeable about wine pairings .,"( wine list , extensive , positive ) ; ( staff , not seem knowledgeable , negative )","( drinks style_options , positive ) ; ( service general , negative )","( wine list, extensive, positive ) ; ( staff, not knowledgeable, negative )","( wine list, extensive, positive ) ; ( staff, not seem knowledgeable about wine pairings, negative )","( drinks style_options, positive ) ; ( service general, negative )","( drinks style_options, positive ) ; ( service general, negative )"
Service was just ok /AS/ it is not what you ' d expect for $ 500 .,"( Service , ok , negative ) ; ( NULL , $ 500 , negative )","( service general , negative ) ; ( restaurant prices , negative )","( Service, ok, neutral )","( Service, ok, neutral )","( service general, neutral )","( service general, neutral )"
The Four Seasons restaurant is a great experience .,"( The Four Seasons restaurant , great , positive )","( restaurant general , positive )","( Four Seasons restaurant, great, positive )","( Four Seasons restaurant, great, positive )","( restaurant general, positive )","( restaurant general, positive )"
An unpretentious spot in Park Slope /AS/ the sushi is consistently good /AS/ the service is pleasant /AS/ effective and unassuming .,"( spot , unpretentious , positive ) ; ( sushi , good , positive ) ; ( service , pleasant , positive ) ; ( service , effective , positive ) ; ( service , unassuming , positive )","( ambience general , positive ) ; ( food quality , positive ) ; ( service general , positive )","( sushi, good, positive ) ; ( service, pleasant, positive ) ; ( service, effective, positive ) ; ( spot, unpretentious, positive ) ; ( spot, unassuming, positive )","( spot, unpretentious, positive ) ; ( sushi, good, positive ) ; ( service, pleasant, positive ) ; ( service, effective, positive ) ; ( service, unassuming, positive )","( food quality, positive ) ; ( service general, positive ) ; ( restaurant miscellaneous, positive )","( food quality, positive ) ; ( service general, positive )"
In the summer months /AS/ the back garden area is really nice .,"( back garden area , nice , positive )","( ambience general , positive )","( back garden area, nice, positive )","( back garden area, nice, positive )","( ambience general, positive )","( ambience general, positive )"
If you are going for the food /AS/ it will not be worth it .,"( food , worth , negative )","( food quality , negative )","( food, not be worth, negative )","( food, not be worth, negative )","( food prices, negative )","( food quality, negative )"
The Cypriot restaurant has a lot going for it .,"( Cypriot restaurant , a lot going , positive )","( restaurant general , positive )","( Cypriot restaurant, lot, positive )","( Cypriot restaurant, a lot going for it, positive )","( restaurant general, positive )","( restaurant general, positive )"
But the service is HORRID !,"( service , HORRID , negative )","( service general , negative )","( service, HORRID, negative )","( service, HORRID, negative )","( service general, negative )","( service general, negative )"
Overall the food quality was pretty good /AS/ though I hear the salmon is much better when it has n ' t sat cooling in front of the guest .,"( food , good , positive )","( food quality , positive )","( food quality, good, positive )","( food quality, good, positive ) ; ( salmon, better, negative )","( food quality, mixed )","( food quality, mixed )"
Great food .,"( food , Great , positive )","( food quality , positive )","( food, Great, positive )","( food, Great, positive )","( food quality, positive )","( food quality, positive )"
AMAZING MY FAVORITE ! ! !,"( NULL , FAVORITE , positive )","( restaurant general , positive )","( NULL, FAVORITE, positive )","( NULL, AMAZING, positive )","( restaurant general, positive )","( food quality, positive )"
I generally like this place .,"( place , like , positive )","( restaurant general , positive )","( place, like, positive )","( place, like, positive )","( restaurant general, positive )","( restaurant general, positive )"
Great survice,"( survice , Great , positive )","( service general , positive )","( survice, Great, positive )","( survice, Great, positive )","( restaurant general, positive )","( restaurant general, positive )"
Highly impressed from the decor to the food to the hospitality to the great night I had !,"( decor , impressed , positive ) ; ( food , impressed , positive ) ; ( NULL , hospitality , positive ) ; ( NULL , great , positive )","( ambience general , positive ) ; ( food quality , positive ) ; ( service general , positive ) ; ( restaurant general , positive )","( decor, impressed, positive ) ; ( food, impressed, positive ) ; ( hospitality, impressed, positive ) ; ( night, great, positive )","( decor, impressed, positive ) ; ( food, impressed, positive ) ; ( hospitality, impressed, positive ) ; ( great night, impressed, positive )","( ambience general, positive ) ; ( food quality, positive ) ; ( ambience general, positive )","( ambience general, positive ) ; ( food quality, positive ) ; ( service general, positive )"
